{
  "id": "r_01JD04EXAMPLE04XQZ7K",
  "version": 3,
  "created_at": "2026-09-03T00:30:00Z",
  "updated_at": "2026-09-03T06:40:00Z",
  "request": {
    "kind": "decision",
    "project": "analytics-side-project",
    "category": "spend.api-budget",
    "title": "Approve a $240 API budget for the benchmark run?",
    "why": "It spends money above the owner's per-purchase approval line.",
    "context": "The run sends 500 sentences × 2 passes to 4 translation APIs. Estimated cost is $200–$240. A smaller run (120 sentences) costs about $60 and still shows which API is clearly worse.",
    "options": [
      {
        "key": "full",
        "label": "Approve $240, full run"
      },
      {
        "key": "small",
        "label": "Approve $80, run 120 sentences first"
      },
      {
        "key": "no",
        "label": "Not now"
      }
    ],
    "rec": "small",
    "rec_reason": "The small run shows whether the comparison is worth it before spending the full amount.",
    "confidence": "medium",
    "risk": [
      "money"
    ],
    "spend": {
      "amount": 80,
      "currency": "USD",
      "period": "once"
    },
    "reversible": false,
    "effort": "30 sec",
    "tier": "now",
    "source": {
      "agent": "measure-agent",
      "host": "claude-code"
    }
  },
  "response": {
    "status": "decided",
    "choice": "small",
    "decided_by": "human",
    "decided_at": "2026-09-03T01:05:00Z",
    "decided_channel": "pwa",
    "conditions": "Hard cap at $80. Stop and report if you hit $65 before finishing."
  },
  "ack": {
    "outcome": "executed",
    "note": "Small run finished at $58; results are in the report. Full run not started.",
    "at": "2026-09-03T06:40:00Z"
  }
}
