{
  "id": "r_01JD02EXAMPLE02XQZ7K",
  "version": 3,
  "created_at": "2026-09-02T07:00:00Z",
  "updated_at": "2026-09-02T08:30:00Z",
  "request": {
    "kind": "decision",
    "project": "recipe-box-app",
    "category": "pricing.paywall-copy",
    "title": "Show a crossed-out \"regular price\" on the paywall?",
    "why": "Reference pricing touches consumer-protection rules and how honest the product feels; that is the owner's call.",
    "context": "A crossed-out higher price usually lifts conversion, but the app has never actually sold at that higher price.",
    "options": [
      {
        "key": "anchor",
        "label": "Show \"regular $6.99, now $3.49\""
      },
      {
        "key": "plain",
        "label": "Show $3.49 only"
      },
      {
        "key": "intro",
        "label": "Show a real time-limited intro price",
        "detail": "Actually sell at $6.99 later, so the reference is true."
      }
    ],
    "rec": "plain",
    "rec_reason": "A reference price that was never charged can be treated as misleading in several markets.",
    "confidence": "high",
    "risk": [
      "legal",
      "brand"
    ],
    "reversible": true,
    "effort": "10 sec",
    "tier": "week",
    "source": {
      "agent": "growth-agent",
      "host": "codex"
    }
  },
  "response": {
    "status": "decided",
    "choice": "plain",
    "decided_by": "human",
    "decided_at": "2026-09-02T08:12:00Z",
    "decided_channel": "pwa"
  },
  "ack": {
    "outcome": "executed",
    "note": "Paywall shows $3.49 only; the A/B variant with a reference price was removed.",
    "at": "2026-09-02T08:30:00Z"
  }
}
