{
  "id": "r_01JD26EXAMPLE26XQZ7K",
  "version": 2,
  "created_at": "2026-09-14T01:00:00Z",
  "updated_at": "2026-09-14T02:00:00Z",
  "request": {
    "kind": "brief",
    "project": "habit-app",
    "category": "brief.weekly",
    "title": "Week 41 in one screen",
    "why": "A summary so you don't have to read the agents' logs.",
    "body": "**Nothing needs you this week.**\n\n- Installs: 132 (+18%)\n- Crash-free sessions: 99.4%\n- 1.2.0 approved and live\n- Refund requests: 2 (both \"bought by mistake\")",
    "effort": "1 min",
    "tier": "later",
    "source": {
      "agent": "report-agent",
      "host": "claude-code"
    }
  },
  "response": {
    "status": "question",
    "note": "What does crash-free look like on the oldest supported OS version only?"
  }
}
