{
  "id": "r_01JD12EXAMPLE12XQZ7K",
  "version": 3,
  "created_at": "2026-09-07T05:00:00Z",
  "updated_at": "2026-09-07T06:30:00Z",
  "request": {
    "kind": "decision",
    "project": "recipe-box-app",
    "category": "outreach.partnership",
    "title": "How to pay creators who promote the app?",
    "why": "It sets the commercial terms with external partners.",
    "options": [
      {
        "key": "flat",
        "label": "Flat fee per video"
      },
      {
        "key": "per-install",
        "label": "Revenue share per paid install",
        "detail": "$1.50 per paid install, settled at purchase time, so it is hard to game."
      }
    ],
    "rec": "per-install",
    "rec_reason": "Pays only for results and settles immediately.",
    "risk": [
      "money",
      "external"
    ],
    "spend": {
      "amount": 1.5,
      "currency": "USD",
      "period": "once"
    },
    "effort": "30 sec",
    "tier": "week",
    "source": {
      "agent": "growth-agent",
      "host": "claude-code"
    }
  },
  "response": {
    "status": "decided",
    "choice": "per-install",
    "decided_by": "human",
    "decided_at": "2026-09-07T06:00:00Z",
    "decided_channel": "pwa",
    "conditions": "Use a unique code per creator, and pay monthly with a 14-day refund window deducted."
  },
  "ack": {
    "outcome": "executed",
    "note": "Terms drafted with per-creator codes and monthly payout; draft is attached to the next review item.",
    "at": "2026-09-07T06:30:00Z"
  }
}
